company_name,category,website,public_signal,partner_fit,status,next_validation_step,source_url
Blueclone Networks,Managed IT/MSP,https://www.blueclone.com/,"Princeton NJ MSP/MSSP serving small and mid-sized businesses; mentions AI enablement and compliance-focused services.","Potential implementation/referral partner for controlled AI workflow projects.",no-contact-research,"Review service pages and decide whether partner angle is complementary or competitive.",https://www.blueclone.com/
Titan Technologies,Managed IT/MSP,https://www.timefortitan.com/,"Managed services, network solutions, cybersecurity, and IT support.","Potential partner for workflow automation that sits outside core IT support.",no-contact-research,"Verify service area and SMB focus before any outreach.",https://www.timefortitan.com/
DigaCore,Managed IT/MSP,https://digacore.com/,"NJ managed IT, cybersecurity, cloud, and managed AI services.","Likely competitor in managed AI, but useful positioning benchmark and possible specialized subcontract path.",no-contact-research,"Benchmark their managed AI language; do not contact until positioning is clear.",https://digacore.com/managed-it-services-in-nj/
Integrated Computer Services,Managed IT/MSP,https://www.icssnj.com/,"NJ MSP with managed IT, cybersecurity, cloud, compliance, and AI-driven automation language.","Likely competitor/benchmark; possible local partner only if JVT wedge is narrower.",no-contact-research,"Use for messaging comparison before considering outreach.",https://www.icssnj.com/
SWK Technologies,Managed IT/MSP,https://www.swktech.com/,"East Hanover MSP providing IT support and services in NJ/NY/PA.","Potential larger-channel benchmark; partner fit depends on small-client overflow.",no-contact-research,"Check whether they partner/subcontract for small workflow projects.",https://www.swktech.com/services/mcs/managed-it-services-new-jersey-msp/
PCS,Managed IT/MSP,https://www.helpmepcs.com/,"Managed IT services across NJ, DE, MA, MD, and PA.","Potential IT-services channel for clients needing admin automation beyond IT support.",no-contact-research,"Review client profile and AI/automation service overlap.",https://www.helpmepcs.com/managed-it-services
Integris,Managed IT/MSP,https://integrisit.com/,"Managed AI and IT services for SMBs; recent public acquisition news highlights SMB AI demand.","Strategic benchmark more than near-term partner because they already sell managed AI.",no-contact-research,"Use as market validation for SMB managed AI demand.",https://integrisit.com/
IT Radix,Managed IT/MSP,https://www.cloudtango.net/msp/New-Jersey,"Cloudtango lists IT Radix as NJ IT outsourcing for small and medium business.","Potential local MSP shortlist candidate; needs direct website/contact verification.",no-contact-research,"Find official website and verify small-business channel fit.",https://www.cloudtango.net/msp/New-Jersey
BluePrint HelpDesk,Managed IT/MSP,https://www.blueprinthelpdesk.com/services/ai-solutions-nj,"Offers AI integration, workflow automation, and compliance support for small businesses in NJ.","Likely competitor/benchmark; useful to refine JVT's less generic hook.",no-contact-research,"Benchmark AI solutions language and decide if partner fit exists.",https://www.blueprinthelpdesk.com/services/ai-solutions-nj
Automate XYZ,Web/automation agency,https://automatexyz.co/,"South Jersey web design, automation, local SEO, and AI automation partner.","High-fit benchmark/possible peer; overlaps home-service and local business automation.",no-contact-research,"Review service scope and differentiation before any partner approach.",https://automatexyz.co/
worldwideRiches,Web/design agency,https://www.worldwideriches.com/nj-web-design.shtml,"NJ web design company with strategy, design, development, SEO, and marketing.","Potential web-agency channel for post-lead intake and workflow automation.",no-contact-research,"Check small-business focus and contact quality before outreach.",https://www.worldwideriches.com/nj-web-design.shtml
HitUsUpDesigns,Web/design agency,https://hitusupdesigns.com/,"South Jersey web design, print, and SEO company targeting SMBs.","Potential partner for clients needing automation after website lead capture.",no-contact-research,"Review contact page and service overlap.",https://hitusupdesigns.com/
Today's Business,Marketing/web agency,https://tbsmo.com/digital-marketing-services-nj/website-development/,"NJ digital marketing agency offering website development and marketing services.","Possible partner for lead-to-follow-up workflow automation behind marketing sites.",no-contact-research,"Review whether SMB/professional-services clients are a fit.",https://tbsmo.com/digital-marketing-services-nj/website-development/
Elite Web Design,Web/design agency,https://elitewebdesign.us/,"NJ small-business web design services.","Potential low-friction channel if clients need intake automation after new sites.",no-contact-research,"Verify company details and public contact path before outreach.",https://elitewebdesign.us/
Business Boosters,Web/design agency,https://www.businessboosters.biz/new-jersey-web-design-agency,"NJ web design and support packages for businesses and nonprofits.","Potential partner if they build sites but do not handle operational automation.",no-contact-research,"Check portfolio/client type and service overlap.",https://www.businessboosters.biz/new-jersey-web-design-agency
The Curchin Group,CPA/bookkeeping,https://www.curchin.com/sectors/small-businesses/,"Small-business accounting, bookkeeping, payroll, consulting, and bundled services.","Possible referral channel for clients needing workflow cleanup around financial/admin processes.",no-contact-research,"Review whether they advise clients on operational systems.",https://www.curchin.com/sectors/small-businesses/
JVA Firm,CPA/bookkeeping,https://www.jvafirm.com/small-business-accounting-services.htm,"Small-business accounting and bookkeeping services in Succasunna NJ.","Possible bookkeeping/CPA partner for client document and meeting packet workflows.",no-contact-research,"Verify contact and fit before any outreach.",https://www.jvafirm.com/small-business-accounting-services.htm
Blue Swan Bookkeeping,Bookkeeping,https://blueswanbookkeeping.com/small-business-bookkeeping/,"NJ bookkeeping for small-business owners, AP/AR, payroll, and reporting.","Potential partner for admin-heavy clients needing workflow cleanup.",no-contact-research,"Review service area and owner/operator contact path.",https://blueswanbookkeeping.com/small-business-bookkeeping/
Supporting Strategies Princeton,Bookkeeping/controller services,https://www.supportingstrategies.com/locations/princeton-nj/,"Remote bookkeeping and controller services for Princeton/Trenton area.","Potential professional-services channel for meeting-to-action and document workflow support.",no-contact-research,"Check whether local franchise/office has partnership openness.",https://www.supportingstrategies.com/locations/princeton-nj/
Clean Slate Tax Relief,Tax/bookkeeping,https://cleanslatetax.com/small-business-bookkeeping-nj/,"Small-business bookkeeping and IRS compliance focus in NJ.","Potential referral channel for clients with messy books and admin workflows.",no-contact-research,"Verify business profile and avoid tax-advice claims.",https://cleanslatetax.com/small-business-bookkeeping-nj/
